{
  "$schema": "https://json-schema.org/draft/2020-12/schema",
  "$id": "https://hydra.local/schemas/gamification/gamification-diagram-1.0.schema.json",
  "title": "HYDRA GamificationDiagram 1.0",
  "type": "object",
  "required": ["schemaVersion", "id", "metamodelId", "definitionModelId", "bindingModelId", "nodes", "edges"],
  "properties": {
    "schemaVersion": { "const": "1.0" },
    "id": { "type": "string" },
    "metamodelId": { "type": "string" },
    "definitionModelId": { "type": "string" },
    "bindingModelId": { "type": "string" },
    "nodes": {
      "type": "array",
      "items": {
        "type": "object",
        "required": ["nodeId", "x", "y"],
        "properties": {
          "nodeId": { "type": "string" },
          "x": { "type": "number" },
          "y": { "type": "number" },
          "width": { "type": "number", "exclusiveMinimum": 0 },
          "height": { "type": "number", "exclusiveMinimum": 0 },
          "collapsed": { "type": "boolean" }
        },
        "additionalProperties": false
      }
    },
    "edges": {
      "type": "array",
      "items": {
        "type": "object",
        "required": ["edgeId"],
        "properties": {
          "edgeId": { "type": "string" },
          "points": {
            "type": "array",
            "items": {
              "type": "object",
              "required": ["x", "y"],
              "properties": { "x": { "type": "number" }, "y": { "type": "number" } },
              "additionalProperties": false
            }
          }
        },
        "additionalProperties": false
      }
    }
  },
  "additionalProperties": false
}
