{
  "schemaVersion": "1.0",
  "id": "people-gamification-diagram",
  "metamodelId": "people",
  "definitionModelId": "people-gamification",
  "bindingModelId": "people-gamification-bindings",
  "nodes": [
    { "nodeId": "evidence:core.validation.violation-resolved", "x": 70, "y": 70, "width": 210, "height": 84, "collapsed": false },
    { "nodeId": "rule:rule:quality", "x": 350, "y": 70, "width": 210, "height": 84, "collapsed": false }
  ],
  "edges": [
    { "edgeId": "evidence-rule:rule:quality", "points": [] }
  ]
}
